{
 "profileId": "SMProfile-Article",
 "version": "2.0.0",
 "standard": "CESMII",
 "category": "business",
 "displayName": "Article (article / part)",
 "description": "next/ v4 — product/material master. Attributes aligned to the LIVE projection of source sim-v5-erp-articles. ISA-95 MaterialDefinition (the definition; physical stock is MaterialLot). Reference entity — no single-entity deviation.",
 "parentType": null,
 "abstract": false,
 "attributes": [
 {
 "name": "article_no",
 "dataType": "String",
 "required": true,
 "category": "Core",
 "delivery": "transactional",
 "scope": "hub",
 "promotion": "on_change"
 },
 {
 "name": "name",
 "dataType": "String",
 "required": false,
 "category": "Core",
 "delivery": "transactional",
 "scope": "hub",
 "promotion": "on_change"
 },
 {
 "name": "type",
 "dataType": "String",
 "required": false,
 "category": "Core",
 "delivery": "transactional",
 "scope": "hub",
 "promotion": "on_change"
 },
 {
 "name": "unit",
 "dataType": "String",
 "required": false,
 "category": "Core",
 "delivery": "transactional",
 "scope": "hub",
 "promotion": "on_change"
 },
 {
 "name": "lead_time_days",
 "dataType": "Int32",
 "required": false,
 "category": "Planning",
 "delivery": "transactional",
 "scope": "hub",
 "promotion": "on_change"
 },
 {
 "name": "abc_class",
 "dataType": "String",
 "required": false,
 "category": "Commercial",
 "delivery": "transactional",
 "scope": "hub",
 "promotion": "on_change"
 },
 {
 "name": "cost_hk",
 "dataType": "Double",
 "required": false,
 "category": "Valuation",
 "unit": "EUR",
 "description": "Standard manufacturing/purchase cost (HK = Herstellkosten), from ERP std_kosten. The €-basis for scrap / quality impact.",
 "delivery": "transactional",
 "scope": "hub",
 "promotion": "on_change"
 },
 {
 "name": "price_vk",
 "dataType": "Double",
 "required": false,
 "category": "Valuation",
 "unit": "EUR",
 "description": "Standard sales price (VK = Verkaufspreis), from ERP std_verkaufspreis. The basis for margin / lost-sales impact. Null for non-sellable articles (RAW/CONSUMABLE/WIP).",
 "delivery": "transactional",
 "scope": "hub",
 "promotion": "on_change"
 },
 {
 "name": "currency",
 "dataType": "String",
 "required": false,
 "category": "Valuation",
 "description": "ISO-4217 currency code for cost_hk / price_vk, from ERP waehrung (e.g. EUR).",
 "delivery": "transactional",
 "scope": "hub",
 "promotion": "on_change"
 }
 ],
 "relationships": [],
 "constraints": {},
 "semantics": [],
 "kpiRefs": [],
 "isa95": {
 "objectModel": "MaterialDefinition",
 "momDomain": "inventory",
 "level": 3,
 "note": "Article / part = ISA-95 MaterialDefinition (Part 2). Physical stock is MaterialLot.",
 "propertyMap": {
 "article_no": "MaterialDefinition.ID",
 "name": "MaterialDefinition.Description",
 "unit": "MaterialDefinition.UnitOfMeasure"
 }
 },
 "kgNodeLabel": "Article",
 "kgIdProperty": "article_no"
}