{
 "profileId": "SMProfile-ProcessSegment",
 "version": "2.0.0",
 "standard": "ISA-95",
 "category": "business",
 "displayName": "Process Segment (reusable manufacturing stage)",
 "description": "next/ v2.0 — Level-3 MOM ProcessSegment (ISA-95 Part 4 / B2MML ProcessSegment). The reusable CAPABILITY of a manufacturing stage: WHICH resources (equipment / material / personnel class) can perform WHICH activity — independent of any concrete order. TERMINOLOGY RULE : a ProcessSegment is exactly one 'plant' in the MES, i.e. a 'Function' in the the function naming standard (Table 1) — e.g. a forming, dosing, or curing stage. It is therefore bound to the equipment hierarchy: PERFORMED_AT points to the EquipmentUnit (ISA-88 Unit / process stage) on which the segment runs. An OperationsDefinition arranges several ProcessSegments into a routing; an OperationsRequest (ProductionOrder) instantiates it and decomposes per segment into a SegmentRequirement. operations_type carries the ISA-95 'Mixed Schedule' split (production | inventory | quality | maintenance).",
 "parentType": null,
 "abstract": false,
 "attributes": [
 {
 "name": "process_segment_no",
 "dataType": "String",
 "required": true,
 "category": "Core",
 "description": "Identity of the ProcessSegment (join key). Recommendation: path- / Function-prefixed, since Function codes are unique per line.",
 "delivery": "transactional",
 "scope": "hub",
 "promotion": "on_change"
 },
 {
 "name": "process_segment_code",
 "dataType": "String",
 "required": false,
 "category": "Core",
 "description": "Raw segment / Function code from the naming source (the function naming standard Table 1 / the MES 'plant' code).",
 "delivery": "transactional",
 "scope": "hub",
 "promotion": "on_change"
 },
 {
 "name": "name",
 "dataType": "String",
 "required": false,
 "category": "Core",
 "description": "Display name of the manufacturing stage (e.g. a forming, dosing, or curing stage).",
 "delivery": "transactional",
 "scope": "hub",
 "promotion": "on_change"
 },
 {
 "name": "operations_type",
 "dataType": "String",
 "required": false,
 "category": "Core",
 "description": "ISA-95 'Mixed Operation Schedule' classification of the stage. Corresponds to the momDomain.",
 "enum": [
 "production",
 "inventory",
 "quality",
 "maintenance"
 ],
 "delivery": "transactional",
 "scope": "hub",
 "promotion": "on_change"
 },
 {
 "name": "sequence",
 "dataType": "Int32",
 "required": false,
 "category": "Planning",
 "description": "Sequence of the stage within the OperationsDefinition (routing).",
 "delivery": "transactional",
 "scope": "hub",
 "promotion": "on_change"
 },
 {
 "name": "duration_planned_sec",
 "dataType": "Int32",
 "required": false,
 "category": "Planning",
 "description": "Planned stage duration (s) as a capability default; overridden by the SegmentRequirement in the concrete order.",
 "unit": "s",
 "delivery": "transactional",
 "scope": "hub",
 "promotion": "on_change"
 },
 {
 "name": "operations_definition_ref",
 "dataType": "String",
 "required": false,
 "category": "Link",
 "description": "FK to OperationsDefinition.operations_definition_no (PART_OF). The routing to which this stage belongs.",
 "delivery": "transactional",
 "scope": "hub",
 "promotion": "on_change"
 },
 {
 "name": "unit_ref",
 "dataType": "String",
 "required": false,
 "category": "Link",
 "description": "FK to EquipmentUnit.unit_id (PERFORMED_AT). The ISA-88 Unit / process stage on which the segment runs — the physical anchoring of the 'plant' / 'Function'.",
 "delivery": "transactional",
 "scope": "hub",
 "promotion": "on_change"
 }
 ],
 "relationships": [
 {
 "type": "PART_OF",
 "target": "OperationsDefinition",
 "targetIdProp": "operations_definition_no",
 "description": "The OperationsDefinition (routing) that sequences this stage."
 },
 {
 "type": "PERFORMED_AT",
 "target": "EquipmentUnit",
 "targetIdProp": "unit_id",
 "description": "The EquipmentUnit (= plant = Function) on which the segment is executed."
 }
 ],
 "constraints": {},
 "semantics": [
 "iso:62264-ProcessSegment",
 "cesmii:ProcessSegment"
 ],
 "kpiRefs": [],
 "isa95": {
 "objectModel": "ProcessSegment",
 "momDomain": "production",
 "level": 3,
 "note": "ISA-95 Part 4 ProcessSegment = reusable manufacturing stage. RULE: ProcessSegment == 'plant' (the MES) == 'Function' (the function naming standard Table 1). PERFORMED_AT binds to the EquipmentUnit (ISA-88 Unit). A SegmentRequirement (PLAN) / SegmentResponse (actuals) references this segment per order. CONTINUOUS PROCESSES (e.g. continuous web/strand goods): here ProcessSegment serves ONLY as a physical classification / filter dimension (= plant = Function), anchored via PERFORMED_AT EquipmentUnit; NO SegmentRequirement/SegmentResponse are instantiated. DISCRETE / segmented manufacturing additionally uses the optional decomposition layer SegmentRequirement (PLAN) / SegmentResponse (actuals). Both readings share the same profile (superset).",
 "propertyMap": {
 "process_segment_no": "ProcessSegment.ID",
 "name": "ProcessSegment.Description",
 "operations_type": "ProcessSegment.OperationsType",
 "duration_planned_sec": "ProcessSegment.Duration",
 "unit_ref": "ProcessSegment.EquipmentSegmentSpecification.EquipmentID"
 }
 },
 "kgNodeLabel": "ProcessSegment",
 "kgIdProperty": "process_segment_no"
}